Title,Summary,Date
"Journal of Policy Modeling, 1 November 2008, 238 words, Yue-Jun Zhang; Ying Fan; Hsien-Tang Tsai; Yi-Ming Wei, (English)","... and risk spillover. Using rigorous appraisal, analysis is made of the influence of US dollar exchange rate on the international crude oil price from the perspective of market trading and several findings have been obtained. Firstly, a significant long-term...",Q4
"Bisnis Indonesia, 9 December 2008, 456 words, (English)","Satrio continued global crude oil factor would also become an important factor that investors would put into account before entering the market. Global crude oil price had double impacts on Indonesia, namely on inflation and energy prices.",Q4
"Bisnis Indonesia, 8 November 2008, 551 words, (English)","JAKARTA: After announcing to cut premium fuel price, the government hints it may lower diesel fuel and subsidized kerosene prices provide global crude oil price is stable at US$60 per barrel for one to two months.",Q4
"Oil Market Intelligence, 15 November 2008, 943 words, (English)","The good news for that endangered species, the Market Bull, is that the speed of the crude oil price descent has slowed a little over the past few weeks. The bad news is that it still appears to be heading downhill. Over the past month, the front-month Nymex...",Q4
"Bisnis Indonesia, 27 December 2008, 548 words, (English)","JAKARTA: The government is asked to immediately lower subsidized premium fuel price to IDR3,500 per liter following declining global crude oil price to less than US$40 per barrel.",Q4
"All Africa, 5:35, 9 October 2008, 419 words, by Siseko Njobeni, (English)","She said Sasol was exposed to the fluctuations of the crude oil price as its National Petroleum Refineries of South Africa (Natref) refinery and its European chemical businesses use crude oil-related raw materials. Also, the selling price of fuel marketed by...",Q4
"Bisnis Indonesia, 24 November 2008, 737 words, (English)","Global crude oil price for January delivery rose 51 cents or 1 percent into US$49.93 per barrel at 14.42 local time at the New York Mercantile Exchange. Last week, oil contract dropped US$7.67 percent or 13 percetn.",Q4
"The Edge Malaysia (Weekly), 3 November 2008, 1204 words, By Doreen Leong, (English)","With slowing growth prospects driving the crude oil price down, the writing on the wall is clear for the O&G players: the record prices seen during 1H2008 were too good to last. True to form, the price of Nymex crude oil has fallen from its peak of US$145 per...",Q4
"Russian Banks and Brokers Reports, 8 December 2008, 2528 words, (English)",Different stages of price drivers: price drivers prior to 3Q08. We believe that the history of crude oil price trends can be split into two distinct periods: before $50/bbl in 2005 and after. The second period can be further subdivided into two periods: from...,Q4
"Federal Register, 1 December 2008, 6183 words, (English)","...""swaps"" in which the two parties exchange cash flows based on pre- determined formulas tied to the crude oil spot price, forward crude oil price, the Benchmark Futures Contract price, or other crude oil futures contract price. USSO anticipates that the use ...",Q4
"Voxant FD (FAIR DISCLOSURE) WIRE, 7 October 2008, 38055 words, (English)","...up the paper and you see crude oil going like that, you don't need to think of where you bought Enbridge. We're not sensitive to crude oil price. We are longer term in terms of the growth prospects of the Company, but in terms of day-to-day, we're not impacted...",Q4
"Voxant FD (FAIR DISCLOSURE) WIRE, 13 November 2008, 11101 words, (English)",...latter part of 2009 or some of the future years in retrospect I think we probably should have but I guess I'm not sure today what crude oil price is going to be at the end of 2009.,Q4
"Thai News Service, 7 November 2008, 328 words, (English)","Section: Stocks - We returned from PTTEP's analyst briefing feeling optimistic about its long term growth prospects. Falling crude oil price has not deterred key projects in the pipeline, but resources might be reallocated to high priority projects.",Q4
"New Sunday Times, 23 November 2008, 638 words, (English)","Earnings of national oil corporation Petronas, a major contributor to the government's coffers, would be reduced. Najib added that in a low crude oil price environment, the incentive to pursue alternative energy sources would also be curtailed.",Q4
"The New Paper, 16 October 2008, 804 words, Desmond Ng, (English)",The oil companies here have always maintained that it is not just the crude oil price that determines how much you pay at the pump. (See report on facing page.),Q4
"Tex Energy Report, 7 November 2008, 274 words, (English)","...other Middle Eastern countries in the time to decide OSP of crude oil which sometimes the cause of higher price than other kind of crude oil price. Recently decided price of AL crude oil for the shipment in October from Saudi Arabia amounted to US$67.689, which...",Q4
"Russia & CIS Energy Daily, 12:48, 15 October 2008, 10035 words, (English)","The influence of international crude oil price changes and the financial turmoil in major world economies is still not visible in China's September oil import figures, as [these imports] are usually settled two months ahead of delivery. But, in the coming ...
(Document PEREP00020081016e4af00001)
+ 1 duplicate article(s) identified
	62.  	Factiva Licensed Content What's the real price of petrol?
Malaysian Business, 16 November 2008, 764 words, By Charles Raj, (English)
So, whenever the world crude oil price fluctuates, we can only hazard a guess as to how this would be translated to the price at our pumps.
(Document MALBUS0020081205e4bg00013)

	63.  	Factiva Licensed Content Goldman: OPEC Cut Of 1 Mln B/D Needed To Balance Oil Market
Dow Jones International News, 4:06, 20 October 2008, 349 words, (English)
The bank recently lowered its 2009 crude oil price forecast to $86 a barrel from a previous $123 barrel and warned crude oil prices could come under further pressure from bearish market sentiment and mounting concerns over oil demand growth.
(Document DJI0000020081020e4ak000d9)

	64.  	Factiva Licensed Content Fuel Prices Should Reach Economic Level
Bisnis Indonesia, 24 October 2008, 451 words, (English)
A member of the downstream gas regulatory agency (BPH Migas) Ibrahim Hasyim revealed since global crude oil price had fallen to less than US$70 per barrel and the rupiah exchange rate against the US dollar had reached IDR9,500, premium fuel economic price could...
(Document BISNIS0020081024e4ao00008)

	65.  	Factiva Licensed Content China's soybean futures likely to dip upon financial crisis panic
Xinhua's China Economic Information Service, 4 November 2008, 210 words, (English)
Due to the spread of global financial crisis, the crude oil price hit the record low in the past two years. As oil has extensive uses, the oil price fall has exerted great impact on most of the commodities and soybean is the one to feel the punch.
(Document XNHA000020081104e4b4002ml)
+ 1 duplicate article(s) identified
	66.  	Factiva Licensed Content Corporate: Are transport stocks worth a look?
The Edge Malaysia (Weekly), 13 October 2008, 888 words, By Racheal Lee Mei Nyee, (English)
Conversely, airline stocks began to pick up when the crude oil price lost ground. With oil falling to a new low of US$91.15 per barrel on Sept 16, MAS' share price rose to close at RM3.70, with 661,500 shares changing hands the next day, while AirAsia's stock...
(Document EDGEWK0020081016e4ad00014)

	67.  	Factiva Licensed Content Premium and Diesel Fuel Prices Finally Cut
Bisnis Indonesia, 15 December 2008, 662 words, (English)
JAKARTA: The government started from last night cut premium and diesel fuel prices from IDR5,500 to IDR5,000 per liter and from IDR5,500 to IDR4,800 per liter following a decline in global crude oil price.
(Document BISNIS0020081215e4cf0002t)
+ 1 duplicate article(s) identified
	68.  	Factiva Licensed Content mixed fortunes ; The impending US recession and fears of demand destruction due...
Business Standard, 10 November 2008, 2880 words, Sarath Chelluri and Jitendra Kumar Gupta, (English)
According to analysts, if the international crude oil price averages out at $90-100 per barrel, then, ONGC's FY09 EPS could range between Rs 92.6-120 assuming subsidy burden of Rs 35,700 crore (calculated on the basis of 1/3 of total subsidy). At the upper ...
(Document BSTN000020081109e4ba00017)

	69.  	Factiva Licensed Content Oil & gas producers to experience good & bad effects of $A fall
Australian Associated Press Financial News Wire, 27 October 2008, 426 words, (English)
MELBOURNE, Oct 27 AAP - The sinking Australian dollar is likely to act as a double-edged sword for domestic petroleum producers as it offsets a declining crude oil price but adds cost to future developments.
(Document AAPFIN0020081027e4ar0015p)

	70.  	Factiva Licensed Content IPI gas pipeline project likely to be put on ice
Business Recorder, 29 November 2008, 522 words, ZAFAR BHUTTA, (English)
...IPI) gas pipeline line project is likely to be put on ice as Iran has doubled the gas price, linking it with 80 percent of global crude oil price, sources told Business Recorder. Iran's new asking price is $7-8 per MMBTU, based on $50 per barrel of crude, and...
(Document AIWBUR0020081201e4bt0002d)

	71.  	Factiva Licensed Content Official says China's fuel prices will drop under new pricing system
BBC Monitoring Asia Pacific, 5:46, 9 December 2008, 599 words, (English)
Current pump prices in China, if converted, were equivalent to a world crude oil price of 83.5 US dollars a barrel, he said.
(Document BBCAPP0020081209e4c9000xf)
+ 3 duplicate article(s) identified
	72.  	Factiva Licensed Content OPEC: Oil Demand Slowdown Exacerbating Market Conditions
Market News International, 9:29, 24 October 2008, 697 words, (English)
... rally between 40-80% when world growth starts to recover, Deutsche said, a rally that will occur within a six month period. ""This would imply crude oil prices back up at $75-85 by the second half of 2010."" This production will mark the start of a ""new quota...",Q4
"Tex Energy Report, 29 October 2008, 441 words, (English)","...saying, ""The production cutback decided this time will contribute to price stabilization preventing from excessive ups and downs of crude oil price from a view point that crude oil price should be within an acceptable range for both consuming countries and ...",Q4
"Mist News, 4:48, 22 October 2008, 738 words, (English)","Mr. Dash, commented: GCC corporate sectors profitability does not depend upon abnormally high crude oil price levels. Global PE analyzed the performance of 183 listed corporates (excluding financials) in GCC and the aggregate results displayed healthy return...",Q4
"Tex Energy Report, 10 October 2008, 630 words, (English)","LPG market in Far East remains on a declining trend in the wake of drop in crude oil price and slumping supply and demand. On October 6th, WTI crude oil price decreased by US$6 and the future CP of November came down to US$670 with a decrease of US$120 compared...",Q4
"China Energy Weekly, 12:46, 15 October 2008, 13910 words, (English)","The influence of international crude oil price changes and the financial turmoil in major world economies is still not visible in China's September oil import figures, as [these imports] are usually settled two months ahead of delivery. But, in the coming ...
(Document CHINEN0020081029e4af00001)

	77.  	Factiva Licensed Content Oil Shale Management--General - Part 1 of 3
Federal Register, 18 November 2008, 36687 words, (English)
...and royalty implication of a production scenario *3 using three discount rates (7 percent, 3 percent, and 20 percent), three world crude oil price projections (Energy Information Administration's (EIA) 2007 reference, high, and low price projections *4 ), and...
(Document FREG000020081118e4bi0003i)

	78.  	Factiva Licensed Content Naira Crash - Oil to Rake in Extra N530 Billion
All Africa, 5:31, 8 December 2008, 807 words, by Ayodele Aminu, (English)
As a result of the volatility in the price of crude oil in the international market, the Federal Government had had to readjust its crude oil price benchmark from the initial $62.50 per barrel proposal to $45.
(Document AFNWS00020081208e4c8000i5)

	79.  	Factiva Licensed Content =DJ Charting Europe: The Fall In Oil, And The Forex Translation
Dow Jones Institutional News, 6:24, 21 November 2008, 702 words, By Axel Rudolph, MSTA, (English)
Looking at the front month Nymex light crude oil futures price in euros, it declined to EUR39.42 Friday from its EUR92.52 July peak. This equates to a drop in the crude oil price of 57.4%.
(Document DJDN000020090803e4bl0mr57)

	80.  	Factiva Licensed Content Wary eye on CPO
Malaysian Business, 16 December 2008, 986 words, By Bhupinder Singh, (English)
Traders and analysts began promoting a strong correlation between CPO price and crude oil price even though the biodiesel industry based on CPO- derived palm methyl ester is in a fledgling state, taking very little of total production in Malaysia and Indonesia...
(Document MALBUS0020090112e4cg00008)

	81.  	Factiva Licensed Content Charting Europe: The Fall In Oil, And The Forex Translation
Dow Jones Capital Markets Report, 6:24, 21 November 2008, 694 words, By Axel Rudolph, MSTA, (English)
Looking at the front month Nymex light crude oil futures price in euros, it declined to EUR39.42 Friday from its EUR92.52 July peak. This equates to a drop in the crude oil price of 57.4%.
(Document CM00000020081121e4bl00020)

	82.  	Factiva Licensed Content Iran Crude Oil Price $34.05/Bbl As Of Wed-Shana
Dow Jones Emerging Markets Report, 8:59, 27 December 2008, 186 words, (English)
Iran's light crude oil price was $36.20 per barrel and heavy crude oil price was $33.28 a barrel in Asian markets on Wed., according to Shana.
(Document EM00000020081227e4cr00001)

	83.  	Factiva Licensed Content Chavez For $80-100/B OPEC Price Band.
APS Review Oil Market Trends, 1 December 2008, 1073 words, (English)
Russia needs an average crude oil price of $75/b as a minimum to balance its budget. At lower crude oil price levels, the Russian economy would suffer a great deal as the country is the world's biggest exporter of natural gas priced against the market value...
(Document APOM000020081203e4c100002)

	84.  	Factiva Licensed Content Showdown at Doha: The Secret Oil Deal That Helped Sink the Shah of Iran
Middle East Journal, 1 October 2008, 15889 words, Andrew Scott Cooper, (English)
His Majesty and I held rapid-fire debate for about 10 minutes on various facets of crude oil price increase issue. Please assure the President that whatever the outcome of the December OPEC meeting, I took pains to insure that His Majesty is fully aware of ...
(Document GMEJ000020081024e4a10000a)

	85.  	Factiva Licensed Content Petroplus Announces Third Quarter 2008 Earnings of $2.00 Per Share Excluding Impacts of the Declining Crude Oil Price Environment
Business Wire Regulatory Disclosure, 0:00, 6 November 2008, 2024 words, (English)
...Financial Officer, said, We ended the quarter in a solid financial position, even after taking into consideration the rapid declining crude oil price environment. In the short term, the decline in the crude oil prices has a negative impact on our cash flows...",Q4
"Auto China, 17 October 2008, 481 words, (English)","With the global crude oil price continuing to drop, some analysts said the time is ripe for China to introduce the long-discussed fuel oil tax.",Q4
"Market News International, 10:16, 8 December 2008, 830 words, (English)","... taken action twelve times to cut production to defend the crude oil price. ""We find that since 1993 OPEC has a 75% success rate of defending the oil price when it takes action and cuts quotas,"" it said, ""However, on two occasions, 1998 and 2001, successive...",Q4
"Industry Updates, 17 October 2008, 479 words, (English)","With the global crude oil price continuing to drop, some analysts said the time is ripe for China to introduce the long-discussed fuel oil tax.",Q4
"ASX ComNews (Text version of ASX Company Announcements), 24 October 2008, 30200 words, (English)",...commodity price fluctuations through the sale of petroleum products denominated in US dollars. The Group may enter into commodity crude oil price swap and option contracts to manage its commodity price risk. At 30 June 2008 the Group has no open oil price swap...,Q4
"Voxant FD (FAIR DISCLOSURE) WIRE, 12 November 2008, 5872 words, (English)","Looking at sensitivities and everything else being equal, at the current oil prices and provided that the difference between crude oil price and bunker oil price remains unchanged, rising oil prices will for the remainder of the year continue to have a moderate...",Q4
"Al-Bawaba News, 24 November 2008, 1959 words, (English)","...the crude oil reserves from major oil fields will lead to a natural decline in crude oil production and have long-term impact on crude oil price. The impact of reserve depletion is expected to begin after 2011. However, we perceive the recent cuts in production...",Q4
"Malaysian Business, 1 October 2008, 1872 words, By James S, (English)","...stocks in the future, and as such, MAS is still not rated as a 'buy' among most analysts despite it benefiting from the falling crude oil price. Why the continued pessimism?",Q4
"The Energy Journal, 1 October 2008, 6728 words, Hammoudeh, Shawkat M. Ewing, Bradley T. Thompson, Mark A., (English)","Borenstein, S., A.C. Cameron, and R. Gilbert (1997). ""Do Gasoline Prices Respond Asymmetrically to Crude Oil Price Changes?"" Quarterly Journal of Economics 112: 305-339.",Q4
"Organisation of Asia-Pacific News Agencies, 10:25, 8 October 2008, 869 words, Andi Abdussalam, By Andi Abdussalam, (English)","Yet, Minister Yusgiantoro said that the Indonesian Crude Oil Price (ICP) was now US$110 per barrel. An average level below US$100 per barrel will only be possible if the prices of Indonesian crude continue to stay below the US$70 level in October-December period...",Q4
"The Saigon Times Daily, 23 October 2008, 773 words, By Hong Van in HCMC, (English)","Do Duc Oanh, a rubber farmer in the southern Binh Duong Province, watches TV every night to see how the crude oil price moves on the world market. He does not know how the crude price may affect the global economy, but he understands deeply that the falling...",Q4
"APS Review Downstream Trends, 3 November 2008, 2079 words, (English)","...prices earned OPEC almost $1 tn, and 2008 was also a good year, except for this last quarter. The IMF says Iraq will need an average crude oil price of $110/b if it is to rebuild its oil industry and achieve its goal of doubling its 2.5m b/d output within a...",Q4
"Canada Stockwatch, 6 November 2008, 2416 words, (English)","...billion ($12.60 to $13.30 per common share) based upon Nov. 3, 2008, strip pricing with a forecast average West Texas Intermediate crude oil price of $69.00 (U.S.) per barrel, a Western Canadian select heavy oil differential of 28 per cent, a Nymex natural ...",Q4
"All Africa, 9:15, 3 November 2008, 751 words, by Emma Okeke, (English)","Lagos, Nov 03, 2008 (This Day/All Africa Global Media via COMTEX) -- The recent fall in the price of crude oil to $63 per barrel from a high of $147 less than two months ago portends grave danger for the Nigerian state.",Q4
"Bernama Daily Malaysian News, 23 October 2008, 305 words, (English)",The government's income in the form of dividends and taxes from petroleum companies in 2010 may decline if the crude oil price in the global market were to stay in the range of US$70 (US$1=RM3.53) per barrel level in 2009.,Q4
"Bisnis Indonesia, 20 October 2008, 698 words, (English)","However, the government has yet planned to lower fuel prices despite the fact global crude oil price has once slumped to US$69 per barrel.",Q4
"MarketWatch, 18:52, 29 August 2008, 1499 words, Myra P. Saefong, MarketWatch, (English)","Prices have been falling in reaction to the downward move in the crude-oil price and because demand for gasoline among American motorists has been less this summer-driving season than it was one year ago, he said.",Q4
"Energy Economics, 1 September 2008, 189 words, Lean Yu; Shouyang Wang; Kin Keung Lai, (English)","...results of all IMFs are combined with an adaptive linear neural network (ALNN), to formulate an ensemble output for the original crude oil price series. For verification and testing, two main crude oil price series, West Texas Intermediate (WTI) crude oil spot...",Q4
"Inside F.E.R.C.'s Gas Market Report, 8 August 2008, 5118 words, Jessica Marron, (English)","Anadarko's hedges hit its crude oil price realizations the hardest. Coupled with both realized and unrealized hedging losses, its average realized crude oil price was just $19.32/barrel — over $100 lower than the $119.81/b realization excluding hedging — compared...",Q4
"Business Standard, 21 July 2008, 918 words, Kalpana Pathak and Nevin John, (English)",Is the volatile crude oil price putting pressure on your profit margins?,Q4
"Market News International, 14:41, 22 July 2008, 383 words, (English)","..., and it found that fundamental supply and demand factors provide the best explanation for the recent crude oil price increases. The CFTC formed the Task Force in June 2008 to evaluate developments in commodity markets, in particular investor practices and ...",Q4
"PR Newswire (U.S.), 2:53, 8 September 2008, 5479 words, (English)","...refining margins. The operating profit included net hedging losses of R2,3 billion realised for the financial year due to the average crude oil price exceeding the hedge zero cost collar cap of US$76,75/barrel as well as a R1,4 billion share-based payment expense...",Q4
"Platts Oilgram News, 3 July 2008, 408 words, Anita Nugraha, (English)","Indonesia's fuel subsidy could rise by more than 300% this year if the crude oil price does not come down from current highs of around $140/barrel, and if it tries to keep domestic prices at current levels, President Susilo Bambang Yudhoyono said July 2.",Q4
"The Australian, 2 August 2008, 1905 words, Tim Blue, (English)","Tony Brennan (DB): The fall in the crude oil price has provided some welcome news for equity markets, because it should help moderate inflation and also ease some of the pressure on incomes and spending.",Q4
"The China Post, 2 August 2008, 581 words, The China Post Staff, (English)","According to CPC spokesman Chu Shao-hua, the average international crude oil price stood at US$131.85 per barrel, rising 2.05 percent or US$2.65 from the June level of US$129.20 per barrel.",Q4
"Bisnis Indonesia, 13 August 2008, 597 words, (English)",Head of the Fiscal Policy Agency at the Department of Finance Anggito Abimanyu viewed it was always possible to revise oil price assumption since global crude oil price had been fluctuating.,Q4
"Mint, 25 August 2008, 1406 words, Nesil Staney,nesil.s@livemint.com, (English)","The logic: strong inverse correlation between Indian equities and global crude oil price is making India a good bet against falling crude oil and other commodity prices, say some of these analysts.",Q4
"All Africa, 6:32, 1 September 2008, 1039 words, by Kennedy Senelwa, (English)","Cost build-up factors include the international crude oil price, shilling-dollar exchange rate, insurance premiums, cost of finance, freight and refining, taxation, inland transport cost and profit margins.",Q4
"Dow Jones International News, 4:14, 6 August 2008, 670 words, (English)","...Wednesday, OMV said its second-quarter net profit rose 66% on the year to EUR684 million, from EUR411 million, driven by a higher crude oil price and downstream revaluation gains, which more than offset lower production and a slightly weaker refining margin...",Q4
"Bisnis Indonesia, 7 July 2008, 359 words, (English)","However, the soaring global crude oil price, potential to reach US$150 per barrel, will create negative sentiments concerning Indonesia's economic balance.",Q4
"Bisnis Indonesia, 15 September 2008, 387 words, (English)","Technically, there is a room for rebound. However, correction will still overshadow the bourse amid the high fluctuation. The market is predicted to stable, waiting for global crude oil price to stay at US$100, Ni Putu told last weekend.",Q4
"Industry Updates, 16 September 2008, 744 words, (English)","...price of crude oil,"" says Wei Weixian, an economist from the University of International Business and Economics. The international crude oil price recently tumbled below $108 a barrel from $147 per barrel in July.",Q4
"Calgary Herald, 4 July 2008, 673 words, Dan Healing, (English)","Twenty dollars ago I said I don't see much upside to the crude oil price, he said. ""At this point I still don't see much upside.""",Q4
"Bernama Daily Malaysian News, 2 August 2008, 234 words, (English)","Malaysian rubber prices are likely to continue their downward trend next week on expectations of lower crude oil price, dealers said.",Q4
"Bisnis Indonesia, 21 July 2008, 488 words, (English)","Commodity stocks represent 30% of the Indonesian bourse's market cap. Global crude oil price has been corrected to US$128.9 per barrel in the wake of a 5% decline in coal price. As a result, the IHSG dropped by 5.9% last weekend.",Q4
"PrimeNewswire, 3 July 2008, 1096 words, (English)","... cover a range of prices between $0 and $200, with an early termination trigger occurring when the benchmarked NYMEX light sweet crude oil price closes at or above $185 for three consecutive business days.",Q4
