Title,Summary,Date
"Xinhua China Oil, Gas & Petrochemicals, 8 June 2008, 1634 words, Chen Dongyi, (English)","...up 63.6% year on year, and the averaged Jan-Apr import price was US$649.13/ton, up 62.5% year on year. In the meantime, domestic crude oil price went up as well. It is predicted that the Daqing crude price will exceed CNY6,000/ton in June. On the contrary, ...",Q2
"Bernama Daily Malaysian News, 8 June 2008, 1538 words, Alan Ting, (English)","Gooi agreed that there was no way that the government could continue to subsidise fuel when the price of crude oil price had reached almost US$140 a barrel. However, he said, the government should have gradually reduced the subsidies to match with the international...",Q2
"Market News International, 14:36, 18 June 2008, 775 words, (English)","...gasoline price spread (the difference between spot gasoline and crude oil price), where refiners operate, has narrowed, indicating plenty of gasoline supply has been available to meet demand. Supply was outpacing demand in January and February, and inventories...",Q2
"Organisation of Asia-Pacific News Agencies, 6:39, 18 June 2008, 401 words, (English)","crude oil price, says the president and chief executive of national oil company,",Q2
"Financial Times (FT.Com), 26 May 2008, 841 words, By John Dizard, (English)","Furthermore, the commission's staff found: ""The recent crude oil price increases have occurred with no significant change in net speculative positions.""",Q2
"Regulatory News Service, 5:06, 15 May 2008, 9035 words, (English)","RNS Number: 5198U TIDMHINA RNS Number : 5198U INA-Industrija Nafte, d.d 15 May 2008 ? INA Group (ZSE: INA - R-A; LSE: HINA; homepage: www.ina.hr), announced its results for FY 2008 today. This report contains consolidated ...",Q2
"Bisnis Indonesia, 31 May 2008, 396 words, (English)",Chairperson of Aspermigas Effendi Siradjuddin revealed the renegotiation was important since the soaring global crude oil price has boosted the windfall profit of the foreign partnership contractors.,Q2
"The China Post, 24 April 2008, 587 words, The China Post Staff, (English)","The CPC adopted the floating pricing mechanism in January 2007, under which it adjusted its domestic fuel prices on a weekly basis in response to crude oil price fluctuations. The system was replaced by a monthly adjustment mechanism last September.",Q2
"Business Times Singapore, 16 May 2008, 989 words, (English)","RAISING crude palm oil (CPO) price estimates: On Wednesday, our regional oil analyst turned more bullish on crude oil price prospects. Instead of a sharp pullback in 2008 and a continued fall in 2009-10, we now expect oil price to stay firm at US$110 per barrel...",Q2
"Bisnis Indonesia, 2 June 2008, 443 words, (English)",Market players will be defensive by trading stocks less sensitive to interest rate and global crude oil price volatility.,Q2
"Ukrainian News, 6 June 2008, 499 words, (English)","(Ukrainian News, Yevhen Holovatiuk, 06/06/2008) Ukrnafta, the largest oil company in Ukraine, welcomes a bill endorsed by the Verkhovna Rada to peg the crude oil rent to the price of crude oil at the London stock exchange.",Q2
"Malaysian Business, 16 May 2008, 2116 words, By James S, (English)","...stocks will have to be fed a continuous stream of positive news flows such as M&A or joint-venture activities and not just the high crude oil price catalyst alone. In such a scenario, the next rally in the sector could well be its last (even if the timing is...",Q2
"The Nation (Thailand), 27 May 2008, 689 words, (English)","an eye on the West Texas Intermediate (WTI) crude oil price movement, which posted a record high in New York. By some calls the WTI price will rise to a level of around US$150 (Bt4,800) or more in the second half of",Q2
"PrimeNewswire, 26 June 2008, 1203 words, (English)","...and will cover a range of prices between $0 and $200, with a termination trigger occurring when the benchmarked NYMEX light sweet crude oil price closes at or above $185 for three consecutive business days.",Q2
"Bernama Daily Malaysian News, 8 June 2008, 409 words, (English)","...was no sign that the price would drop. ""The fuel price restructuring has enabled the government to save RM4 billion but when the crude oil price went up to AS$138.54 a barrel (RM450.25) on Wednesday, the saving was wiped out,"" he told reporters after opening...",Q2
"The Korea Herald, 30 June 2008, 379 words, (English)",They said the government plans to have public offices and firms further reduce spending on electricity and encourage people to conserve energy if the crude oil price tops $150 per barrel.,Q2
"Associated Press Newswires, 16:04, 4 April 2008, 1090 words, (English)","Jefferies & Co. boosted its crude oil price forecast. ""We are raising our 2008 WTI crude oil price forecast to a range of $90 to $100 from $77 and introducing our 2009 estimate of $80-90,"" analyst Stephen D. Gengaro wrote in a note to investors. ""We are also...",Q2
"Tex Energy Report, 21 April 2008, 584 words, (English)","Crude oil price, which has lost touch with actual demand, has continuously been soaring. While its quotation in near-term on NYMEX futures market has reached US$114.93/bbl, the prices of the petroleum products both in Japan and abroad have seriously been increasing...",Q2
"Tex Energy Report, 22 April 2008, 345 words, (English)","...strongly predicted to be seen despite drop-off season. With April CP down by US$10.00-US$15.00, propane decreased 100% compared with crude oil price. No one sees CP as low, which has been changing at high in accordance with the movement in crude oil price. ...",Q2
"Financial Times (FT.Com), 16 May 2008, 828 words, By Kevin Done, Aerospace Correspondent, (English)","BA warned the current first quarter from April to June would be ""particularly difficult"" given the jump in the crude oil price from $58 a year ago to around $115 a barrel.",Q2
"Market News Publishing, 12:53, 1 May 2008, 5139 words, (English)","IMPERIAL OIL LTD (""IMO-TABHDPX3"") - First-Quarter Financial and Operating Results Imperial Oil today announced net income for the first quarter of 2008 of $681 million or $0.75 a share, compared with $774 million or $0.81 a share ...",Q2
"Hydrocarbon Processing, 2 May 2008, 4963 words, (English)","...barrel of oil contains about 6,200 MBtus, the required furnace energy for conversion is about 1.6% of the oil processed.[3] At a crude oil price of $90/bbl, the energy cost for processing is nearly $1.44/bbl.[4] As shown in Table 1, the annual energy cost for...",Q2
"PR Newswire (U.S.), 16:11, 8 May 2008, 7413 words, (English)","OKLAHOMA CITY, May 8 /PRNewswire-FirstCall/ -- SandRidge Energy, Inc. (NYSE: SD) today announced financial and operational results for the first quarter of 2008. Key results for the quarter were:",Q2
"The Hindu, 27 May 2008, 482 words, Staff Reporter, (English)","Addressing the 24th State conference of Indian National Trade Union Congress (INTUC), Mr. Chidambaram said crude oil price determined the price of each and every commodity.",Q2
"CTK Business News, 11:57, 26 May 2008, 437 words, (English)",Crude oil price is also influenced by higher demand in China where power stations are being closed down owing to insufficient coal reserves and replaced with diesel oil generators.,Q2
"All Africa, 5:50, 27 June 2008, 499 words, by Siseko Njobeni, (English)","He said it was up to governments to take a stand against the rising crude oil price. ""Who benefits from the high crude oil price? There is no way that the oil-producing countries are laughing all the way to the bank because the increase affects their food prices...",Q2
"Bisnis Indonesia, 16 April 2008, 307 words, (English)",The crude oil price has jumped by 37% this year on the 12% depreciation of dollar against euro as the Federal Reserve Bank of the US has cut the Fed Fund Rate on September 18 2007.,Q2
"Agence France Presse, 5:14, 11 April 2008, 165 words, SM, (English)","Investors will sit back and watch quarterly results in corporate America next week, especially in the financial sector, as well as stubbornly high crude oil price movements, said Lim Dong-min, an analyst at Dongbu Securities.",Q2
"AFX Asia, 4:20, 11 April 2008, 754 words, (English)","Investors will sit back and watch quarterly results in corporate America next week, especially in the financial sector, as well as stubbornly high crude oil price movements, said Lim Dong-min, an analyst at Dongbu Securities.",Q2
"ASX ComNews (Text version of ASX Company Announcements), 8 September 2008, 90321 words, (English)","ASX ANNOUNCEMENT Monday, 8 September 2008 TAKEOVER OFFER FOR ANZON AUSTRALIA LIMITED TARGET’S STATEMENT I attach by way of service pursuant to item 14 of the Corporations Act 2001 (Cth), a copy of the target’s statement of Anzon Australia ...",Q3
"ASX ComNews (Text version of ASX Company Announcements), 8 September 2008, 90411 words, (English)","ASX ANNOUNCEMENT Monday, 8 September 2008 TAKEOVER OFFER FOR ANZON AUSTRALIA LIMITED UPDATED TARGET’S STATEMENT This document contains minor amendments to the document lodged with ASX earlier today which were not included in that document ...",Q3
"ASX ComNews (Text version of ASX Company Announcements), 1 July 2008, 161297 words, (English)","    JOINT ASX / MEDIA ANNOUNCEMENT Tuesday, 1 July 2008 ARC ENERGY AND AWE MERGER UPDATE Court Convenes ARC Shareholder Meetings Independent Expert Finds Merger in Best Interests of ARC ...",Q3
"ASX ComNews (Text version of ASX Company Announcements), 1 July 2008, 161299 words, (English)","    JOINT ASX / MEDIA ANNOUNCEMENT Tuesday, 1 July 2008 ARC ENERGY AND AWE MERGER UPDATE Court Convenes ARC Shareholder Meetings Independent Expert Finds Merger in Best Interests of ARC ...",Q3
"ASX ComNews (Text version of ASX Company Announcements), 7 August 2008, 92942 words, (English)","7 August 2008 The Manager, Companies Australian Securities Exchange REPLACEMENT BIDDER'S STATEMENT Further to the announcement released ...",Q3
"ASX ComNews (Text version of ASX Company Announcements), 15 September 2008, 134853 words, (English)",15 September 2008 Manager Companies ASX Limited 20 Bridge Street SYDNEY NSW 200 Dear Sir INDEPENDENT EXPERT'S REPORT Attached herewith for immediate release to the market is the Independent Expert’s Report of Grant Samuel dated 15 ...,Q3
"ASX ComNews (Text version of ASX Company Announcements), 17 September 2008, 146947 words, (English)",17 September 2008 Manager Companies ASX Limited Exchange Centre 4th Floor 20 Bridge Street SYDNEY NSW 2000 Dear Sir Takeover bid for Origin Energy Limited by BG International (AUS) Investments 1 Pty Limited (BG) - Second Supplementary ...,Q3
"ASX ComNews (Text version of ASX Company Announcements), 22 August 2008, 17059 words, (English)",...refinery production as a result of both planned and unplanned maintenance and the impact of the stronger Australian dollar and higher crude oil price on refiner margins. “Caltex recognised early in 2008 the possible negative impact of rising crude oil prices...,Q3
"Regulatory News Service, 2:00, 29 August 2008, 23330 words, (English)","...which we sell crude oil and refined products is the primary driver of our revenues. During the first half of 2008, the Brent crude oil price fluctuated between $87 and $139 per barrel and reached its peak of $139.10 at the end of June. According to OPEC, despite...",Q3
"Marketwire (English), 1:01, 7 August 2008, 29027 words, (English)","...----------------------- Crude oil Crude oil price Jul 2008 - Sep 2008 25,000 bbl/d US$60.00- US$80.46 WTI collars Jul 2008 - Sep 2008 25,000 bbl/d US$70.00-US$123.75 WTI Mayan Jul 2008 - Dec 2008 20,000 bbl/d US$50.00-US$65.53 Heavy Jul 2008 - Dec 2008 50,000...",Q3
"Bisnis Indonesia, 3 September 2008, 736 words, (English)",JAKARTA: Global crude oil price hits its five-month low following repair works on production facilities of some oil companies after Gustav typhoon passed Mexico Bay without inflicting any significant damages.,Q3
"Bisnis Indonesia, 29 July 2008, 502 words, (English)","Minister of Finance and Acting Coordinating Minister for Economic Affairs Sri Mulyani Indrawati revealed global crude oil price throughout July 2008 had showed a positive trend, declining up to US$120 per barrel.",Q3
"Business Wire Regulatory Disclosure, 2:00, 10 September 2008, 31642 words, (English)","... respect, Resolution 195 establishes that the benchmark average price will be the “Venezuelan Basket” price instead of the Brent crude oil price referred to in the Law and in Resolution 151. As of the date of these financial statements, the final effects of...",Q3
"Federal Register, 23 July 2008, 32675 words, (English)","...and royalty implication of a production scenario *3 using three discount rates (7 percent, 3 percent, and 20 percent), three world crude oil price projections (EIA's 2007 reference, high, and low price projections *4 ), and six different royalty rates (1 percent...",Q3
"The Handbook of World Stock, Derivative & Commodity Exchanges, 25 August 2008, 14803 words, (English)","Street address: World Financial Center, One North End Avenue, New York NY, 10282-1101, USA Telephone: +1 212 299 2000 Fax: +1 212 301 4700 Email: exchangeinfo@nymex.com",Q3
"The Handbook of World Stock, Derivative & Commodity Exchanges, 14 July 2008, 14803 words, (English)","Street address: World Financial Center, One North End Avenue, New York NY, 10282-1101, USA Telephone: +1 212 299 2000 Fax: +1 212 301 4700 Email: exchangeinfo@nymex.com",Q3
"The Handbook of World Stock, Derivative & Commodity Exchanges, 14 September 2008, 14803 words, (English)","Street address: World Financial Center, One North End Avenue, New York NY, 10282-1101, USA Telephone: +1 212 299 2000 Fax: +1 212 301 4700 Email: exchangeinfo@nymex.com",Q3
"ASX ComNews (Text version of ASX Company Announcements), 14 August 2008, 46595 words, (English)","14 August 2008 ROC OIL COMPANY LIMITED (""ROC"") STOCK EXCHANGE RELEASE DESPATCH OF BIDDER'S STATEMENT",Q3
"ASX ComNews (Text version of ASX Company Announcements), 29 August 2008, 47288 words, (English)","... foreign currency swaps, interest rate swaps and commodity crude oil price swap and option contracts. Their use is subject to policies and procedures as approved by the Board of Directors. The consolidated entity does not trade in derivative financial instruments...",Q3
"Market News Publishing, 18:44, 7 August 2008, 6006 words, (English)","...per barrel compared to $53.63 in the second quarter of 2007. The 2008 increase was a result of a 91 per cent increase in $US WTI crude oil price combined with narrower price differentials relative to WTI, partially offset by a stronger Canadian dollar.",Q3
"Bisnis Indonesia, 25 July 2008, 501 words, (English)","JAKARTA: Global crude oil price again soars after it had been declining over the past seven weeks, rushing traders to buy oil contracts.",Q3
"Federal Register, 13 August 2008, 18588 words, (English)","...selecting from a probability distribution curve *18 for that factor. *19 Since the probability of the specific value of a future crude oil price is built into the distribution curve for crude oil prices, the greater the probability of a certain crude oil price...",Q3
"Industry Updates, 3 July 2008, 972 words, (English)","... in 2006 and imported 159.28 million tons in 2007. The figure for 2008 is estimated to be 170 million tons. If the international crude oil price keeps climbing like it has done in the first six months of the year, the huge oil import alone would cost China ...",Q3
"Bisnis Indonesia, 17 September 2008, 576 words, (English)","JAKARTA: Pessimism toward the global economy abounds, lowering global crude oil price to its seven-month low of US$92 per barrel. However, the government has yet had any intention to correct subsidized domestic fuel prices after it raised the prices by an average...",Q3
"Voxant FD (FAIR DISCLOSURE) WIRE, 6 August 2008, 10280 words, (English)","...last year's quarter, it was minus EUR33 million. So I think -- was minus EUR53 million. Therefore, you see the impact of this high crude oil price in terms of energy consumption into our refineries.",Q3
"PR Newswire (U.S.), 21:22, 5 August 2008, 5934 words, (English)",Increased Crude Oil Price Hedging for Specialty Products Segment,Q3
"Bisnis Indonesia, 4 July 2008, 1039 words, (English)","Over the past 20 days, the index has not been connected to PT Bumi Resources Tbk [BUMI] stock since the index has been connected more to market fundamental issues, such as interest rate, inflation, and global crude oil price, he said yesterday.",Q3
"Market News Publishing, 16:44, 24 July 2008, 5744 words, (English)",...Midstream WTI benchmark crude oil price $ 123.98 U.S. $1.00/bbl NYMEX benchmark natural gas price (1) $ 10.93 U.S. $0.20/mmbtu WTI/Lloyd crude blend differential (2) $ 21.95 U.S. $1.00/bbl Downstream Light oil margins $ 0.06 Cdn $0.005/litre Asphalt margins...,Q3
"All Africa, 8:43, 9 September 2008, 607 words, by Siseko Njobeni, (English)",Sasol's profits are sensitive to movements in the crude oil price. Ramon said a $1 increase in the price of crude oil increased the group's operating profit before tax by R400m.,Q3
"Atlantic Economic Journal, 1 September 2008, 840 words, Hsing, Yu, (English)","JEL E50 * Q00 The price of crude oil recently reach $100 per barrel. There have been concerns about its potential adverse impacts on the economy, consumers, and businesses. Several recent studies [Hamilton (2000), ""What is an oil ...",Q3
"ASX ComNews (Text version of ASX Company Announcements), 1 September 2008, 7359 words, (English)",...interim results from the first half of this year. [Slide 10 – Profit underpinned by strong marketing performance] Movements in the crude oil price can materially impact statutory profit results for Caltex. In an environment such as we have been experiencing...,Q3
"Bisnis Indonesia, 31 July 2008, 473 words, (English)","...the 2009 State Budget Draft to US$130 per barrel from US$140 per barrel. The Minister of Finance previously explained the global crude oil price in July 2008 showed a positive trend by having its price dropped to US$120 per barrel. (Bisnis, July 29)",Q3
"The Middle East, 1 July 2008, 2948 words, Smith, Pamela Ann, (English)","...York and from ICE (Intercontinental Exchange) futures in London. Nymex is the WTI (West Texas Intermediate, a pricing benchmark for crude oil) price, ICE the price for Brent crude (a pricing benchmark for oil from the North Sea that is also widely used for ...",Q3
"Bisnis Indonesia, 16 September 2008, 330 words, (English)",JAKARTA: The impact of Hurricane Ike on lower US oil production and Lehman Brothers Holding Inc's bankruptcy has lowered global crude oil price to US$96.14 per barrel.,Q3
"Bisnis Indonesia, 20 September 2008, 589 words, (English)","In a week, the index has increased by 87.67 points, while global crude oil price has climbed by 5%.",Q3
"Interfax: China Energy Weekly, 12:19, 9 July 2008, 20352 words, (English)","NYMEX crude oil breached $145 per barrel on July 4, and the brokerage has raised its annual average crude oil price forecast from $110 per barrel to $125 per barrel for this year, and put prices for next year at an aggressive $115 per barrel.",Q3
"China Energy Weekly, 16:13, 3 September 2008, 19085 words, (English)","The strong performance of CNOOC Ltd. in the first half of 2008 was not just due to a high crude oil price on the global market. It was also due to the company's output growth and its effective cost controls, said Fu Chengyu, chief executive officer of CNOOC...",Q3
"Federal Register, 19 August 2008, 25007 words, (English)","...What has change in the last year to make the price almost double? SPECULATION BY ANALYSTS.""); D. Smith (""As much as 60% of today's crude oil price is pure speculation driven by large trader banks and hedge funds.""); Van Hecke (""I also feel there needs to be...",Q3
"Tex Energy Report, 30 September 2008, 646 words, (English)","...Japanese market has been fluctuating with strong tone linked with Henry Hub and European NBP price before the beginning of summer when crude oil price was on the increase. However, after the extreme heat in the summer the price of Henry Hub dropped to US$7'...",Q3
"ASX ComNews (Text version of ASX Company Announcements), 19 August 2008, 35819 words, (English)",Target’s Statement by Origin ...,Q3
"Tex Energy Report, 13 August 2008, 602 words, (English)","By that time of underlying upward trend, crude oil price had updated record high with enhanced buying interest induced by comparatively low price of crude oil at the settlement in US dollar which was caused by depreciation of US dollar in the wake of decline...",Q3
"Regulatory News Service, 2:00, 22 August 2008, 7531 words, (English)",... of the crude oil price for the next 28 years; - timing of the capital expenditure spend; - crude oil production profile for the next 28 years; - cost estimates for capital and non-capital expenditure and production costs; - availability of rigs; and - flow...,Q3
"Organisation of Asia-Pacific News Agencies, 8:49, 15 August 2008, 364 words, (English)","The government proposes the assumption of Indonesia's crude oil price level for 2009 at US$100 per barrel. This price is still within the price range approved by the DPR, namely between US$95-$120 per barrel, the president said in his State-of-the-Nation ...",Q3
"Bisnis Indonesia, 5 July 2008, 730 words, (English)","The soaring global crude oil price affected the international airline companies. The report of the International Air Transport Association (IATA) shows that 24 airlines bankrupted and categorized into file bankruptcy law, said Secretary General of the Indonesia...",Q3
"Financial Times (FT.Com), 21 August 2008, 617 words, By Michael Mackenzie in New York and Chris Flood in London, (English)","...cent before takeover speculation helped it end the day with a loss of 1.2 per cent. The S&P 500 rose 0.2 per cent. The benchmark US crude oil price leapt as much as $6.48 to a session high of $122.04 - up 7.3 per cent from its close last Friday of $111.34, ...",Q3
"Dow Jones Capital Markets Report, 5:04, 17 July 2008, 915 words, By Axel Rudolph, MSTA, (English)","LONDON (Dow Jones)--The drop in the crude oil price over the last few days is probably the first leg of a significant correction lower, with a double top having formed over the past few weeks.",Q3
"Dow Jones Institutional News, 6:30, 6 August 2008, 16371 words, (English)","...2009 as part of its on going price risk management program. NuVista has also hedged crude oil prices as part of its ongoing crude oil price risk management program. Subsequent to entering into these price risk management contracts, natural gas and crude oil...",Q3
"Bisnis Indonesia, 27 September 2008, 412 words, (English)","JAKARTA: The government hints it will not lower subsidized fuel prices this year, despite the fact global crude oil price is in a declining trend. This is in contrast with Malaysia and Vietnam that have already lowered their fuel prices.",Q3
"Bisnis Indonesia, 12 August 2008, 475 words, (English)",JAKARTA: The National Development Planning Agency (Bappenas) reveals there is a possibility that Indonesia will fix subsidized fuel prices based on global crude oil price movement.,Q3
"Bisnis Indonesia, 1 July 2008, 563 words, (English)","JAKARTA: The government states it will not propose the second Revised State Budget Draft, despite the fact the state budget has been getting pressures from the global crude oil price, which has soared to more than US$140 per barrel.",Q3
"BRW, 21 August 2008, 712 words, Anthony Sibillin, Report: Anthony Sibillin, (English)","The answer to the first question is, probably, although analysts expect the crude oil price to jump around over the next 12 to 18 months.",Q3
"EUR-Lex, 3 July 2008, 7361 words, (English)","Consumer fuel prices have been increasing sharply in the EU following the crude oil price trend. Although the percentage increase is smaller for consumer prices due to the share of taxation, average consumer prices in EU-27 have increased for petrol (Euro-super...",Q3
"Dow Jones Institutional News, 9:08, 11 August 2008, 21871 words, (English)","CALGARY, Aug. 11 /CNW/ - Crescent Point Energy Trust, (""Crescent Point"" or the ""Trust"") (TSX: CPG.UN), is pleased to announce its operating and financial results for the second quarter and six months ended June 30, 2008. << ...",Q3
"Baltic Business Daily, 8 July 2008, 486 words, (English)","Natural gas price is pegged to the crude oil price (with the sulphur content of 1 pct) on the oil product exchange FOB ARA. As the crude oil price changes, the correspondence group of the natural gas price are changed.",Q3
"Assam Tribune, 5 August 2008, 1528 words, (English)",...its findings has projected a very grim scenario for the inflation battered poor and developing countries of the world. The present crude oil price of US $ 146 a barrel is unlikely to abate nor the shortage of food articles. Therefore the countries who are dependent...,Q3
"Bisnis Indonesia, 25 August 2008, 435 words, (English)","JAKARTA: Market players are keeping a watchful eye on the progress of Russian conflict in Georgia border area, which last week upped crude oil price to US$121.18 per barrel.",Q3
"PR Newswire Asia, 6:30, 23 September 2008, 1313 words, (English)","...during times of financial crisis there will be some short-term investment in the crude oil market as a safe haven, the international crude oil price still may slide down to a more rational price, relaxing inflationary pressures. As one of the world's biggest...",Q3
